{
  "name": "Protein",
  "name_key": "mypack.nutrition.protein",
  "max_value": 100,
  "decay_percent_per_minute": 1,
  "order": 10,
  "color": "#A96C58",
  "icon": "minecraft:textures/item/beef.png",
  "thresholds": [
    {
      "min": 60,
      "max": 100,
      "modifiers": [
        {
          "attribute": "minecraft:generic.max_health",
          "amount": 2,
          "operation": "addition"
        }
      ]
    }
  ]
}
